{
  "$schema": "https://json-schema.org/draft/2020-12/schema",
  "$id": "urn:research-loom:profiles:effective-profile-set:0.1.0",
  "title": "research-loom effective profile set",
  "description": "Resolved deterministic Profile composition boundary with immutable content pins and lossless selection provenance.",
  "type": "object",
  "additionalProperties": false,
  "required": [
    "schema_version",
    "core_contracts",
    "candidate_universe",
    "requested_profiles",
    "effective_profiles",
    "effective_constraints",
    "core_invariants"
  ],
  "properties": {
    "schema_version": {
      "const": "0.1.0"
    },
    "core_contracts": {
      "type": "object",
      "additionalProperties": false,
      "required": [
        "research_contract",
        "invariant_contract"
      ],
      "properties": {
        "research_contract": {
          "$ref": "#/$defs/semver"
        },
        "invariant_contract": {
          "$ref": "#/$defs/semver"
        }
      }
    },
    "candidate_universe": {
      "type": "array",
      "minItems": 1,
      "items": {
        "$ref": "#/$defs/pinned_profile_ref"
      }
    },
    "requested_profiles": {
      "type": "array",
      "minItems": 1,
      "items": {
        "$ref": "#/$defs/profile_requirement"
      }
    },
    "effective_profiles": {
      "type": "array",
      "minItems": 1,
      "items": {
        "$ref": "#/$defs/effective_profile"
      }
    },
    "effective_constraints": {
      "type": "array",
      "items": {
        "$ref": "#/$defs/effective_constraint"
      }
    },
    "core_invariants": {
      "type": "array",
      "items": {
        "$ref": "#/$defs/effective_invariant"
      }
    },
    "effective_resources": {
      "type": "array",
      "items": {
        "$ref": "#/$defs/effective_resource"
      }
    }
  },
  "$defs": {
    "semver": {
      "type": "string",
      "pattern": "^(0|[1-9][0-9]*)\\.(0|[1-9][0-9]*)\\.(0|[1-9][0-9]*)$"
    },
    "version_range": {
      "type": "string",
      "description": "Exact SemVer or a whitespace-separated conjunction of simple SemVer comparators.",
      "pattern": "^(?:(?:0|[1-9][0-9]*)\\.(?:0|[1-9][0-9]*)\\.(?:0|[1-9][0-9]*)|(?:(?:>=|>|<=|<|=)(?:0|[1-9][0-9]*)\\.(?:0|[1-9][0-9]*)\\.(?:0|[1-9][0-9]*))(?:\\s+(?:(?:>=|>|<=|<|=)(?:0|[1-9][0-9]*)\\.(?:0|[1-9][0-9]*)\\.(?:0|[1-9][0-9]*)))*)$"
    },
    "profile_id": {
      "type": "string",
      "pattern": "^[a-z0-9][a-z0-9._-]{0,127}$"
    },
    "profile_type": {
      "enum": [
        "research",
        "organization",
        "narrative",
        "publication"
      ]
    },
    "sha256": {
      "type": "string",
      "pattern": "^[0-9a-f]{64}$"
    },
    "profile_requirement": {
      "type": "object",
      "additionalProperties": false,
      "required": [
        "profile_id",
        "profile_type",
        "version"
      ],
      "properties": {
        "profile_id": {
          "$ref": "#/$defs/profile_id"
        },
        "profile_type": {
          "$ref": "#/$defs/profile_type"
        },
        "version": {
          "$ref": "#/$defs/version_range"
        }
      }
    },
    "pinned_profile_ref": {
      "type": "object",
      "additionalProperties": false,
      "required": [
        "profile_id",
        "profile_type",
        "profile_version",
        "manifest_sha256"
      ],
      "properties": {
        "profile_id": {
          "$ref": "#/$defs/profile_id"
        },
        "profile_type": {
          "$ref": "#/$defs/profile_type"
        },
        "profile_version": {
          "$ref": "#/$defs/semver"
        },
        "manifest_sha256": {
          "$ref": "#/$defs/sha256"
        }
      }
    },
    "selection_source": {
      "oneOf": [
        {
          "type": "object",
          "additionalProperties": false,
          "required": [
            "relation",
            "required_version"
          ],
          "properties": {
            "relation": {
              "const": "requested"
            },
            "required_version": {
              "$ref": "#/$defs/version_range"
            }
          }
        },
        {
          "type": "object",
          "additionalProperties": false,
          "required": [
            "relation",
            "introduced_by",
            "required_version"
          ],
          "properties": {
            "relation": {
              "enum": [
                "extends",
                "requires"
              ]
            },
            "introduced_by": {
              "$ref": "#/$defs/pinned_profile_ref"
            },
            "required_version": {
              "$ref": "#/$defs/version_range"
            }
          }
        }
      ]
    },
    "effective_profile": {
      "type": "object",
      "additionalProperties": false,
      "required": [
        "profile_id",
        "profile_type",
        "profile_version",
        "manifest_sha256",
        "selection_provenance"
      ],
      "properties": {
        "profile_id": {
          "$ref": "#/$defs/profile_id"
        },
        "profile_type": {
          "$ref": "#/$defs/profile_type"
        },
        "profile_version": {
          "$ref": "#/$defs/semver"
        },
        "manifest_sha256": {
          "$ref": "#/$defs/sha256"
        },
        "selection_provenance": {
          "type": "array",
          "minItems": 1,
          "uniqueItems": true,
          "items": {
            "$ref": "#/$defs/selection_source"
          }
        }
      }
    },
    "constraint_source": {
      "type": "object",
      "additionalProperties": false,
      "required": [
        "profile_id",
        "profile_type",
        "profile_version",
        "manifest_sha256",
        "constraint_id"
      ],
      "properties": {
        "profile_id": {
          "$ref": "#/$defs/profile_id"
        },
        "profile_type": {
          "$ref": "#/$defs/profile_type"
        },
        "profile_version": {
          "$ref": "#/$defs/semver"
        },
        "manifest_sha256": {
          "$ref": "#/$defs/sha256"
        },
        "constraint_id": {
          "type": "string",
          "minLength": 1
        }
      }
    },
    "effective_constraint": {
      "type": "object",
      "additionalProperties": false,
      "required": [
        "path",
        "merge_strategy",
        "value",
        "resolution",
        "provenance"
      ],
      "properties": {
        "path": {
          "type": "string",
          "pattern": "^(?!core\\.)(?:[a-z][a-z0-9_]*)(?:\\.[a-z][a-z0-9_]*)+$"
        },
        "merge_strategy": {
          "enum": [
            "must_equal",
            "union",
            "intersection",
            "max",
            "min",
            "replace"
          ]
        },
        "value": {},
        "resolution": {
          "enum": [
            "single",
            "identical",
            "union",
            "intersection",
            "max",
            "min",
            "descendant_replace"
          ]
        },
        "provenance": {
          "type": "array",
          "minItems": 1,
          "items": {
            "$ref": "#/$defs/constraint_source"
          }
        }
      },
      "allOf": [
        {
          "if": {
            "properties": {
              "merge_strategy": {
                "const": "must_equal"
              }
            },
            "required": [
              "merge_strategy"
            ]
          },
          "then": {
            "properties": {
              "resolution": {
                "enum": [
                  "single",
                  "identical"
                ]
              }
            }
          }
        },
        {
          "if": {
            "properties": {
              "merge_strategy": {
                "const": "union"
              }
            },
            "required": [
              "merge_strategy"
            ]
          },
          "then": {
            "properties": {
              "resolution": {
                "enum": [
                  "single",
                  "identical",
                  "union"
                ]
              },
              "value": {
                "type": "array",
                "uniqueItems": true
              }
            }
          }
        },
        {
          "if": {
            "properties": {
              "merge_strategy": {
                "const": "intersection"
              }
            },
            "required": [
              "merge_strategy"
            ]
          },
          "then": {
            "properties": {
              "resolution": {
                "enum": [
                  "single",
                  "identical",
                  "intersection"
                ]
              },
              "value": {
                "type": "array",
                "uniqueItems": true
              }
            }
          }
        },
        {
          "if": {
            "properties": {
              "merge_strategy": {
                "const": "max"
              }
            },
            "required": [
              "merge_strategy"
            ]
          },
          "then": {
            "properties": {
              "resolution": {
                "enum": [
                  "single",
                  "identical",
                  "max"
                ]
              },
              "value": {
                "type": "number"
              }
            }
          }
        },
        {
          "if": {
            "properties": {
              "merge_strategy": {
                "const": "min"
              }
            },
            "required": [
              "merge_strategy"
            ]
          },
          "then": {
            "properties": {
              "resolution": {
                "enum": [
                  "single",
                  "identical",
                  "min"
                ]
              },
              "value": {
                "type": "number"
              }
            }
          }
        },
        {
          "if": {
            "properties": {
              "merge_strategy": {
                "const": "replace"
              }
            },
            "required": [
              "merge_strategy"
            ]
          },
          "then": {
            "properties": {
              "resolution": {
                "enum": [
                  "single",
                  "identical",
                  "descendant_replace"
                ]
              }
            }
          }
        },
        {
          "if": {
            "properties": {
              "path": {
                "const": "evidence.capture.required_fields"
              }
            },
            "required": [
              "path"
            ]
          },
          "then": {
            "properties": {
              "value": {
                "type": "array",
                "uniqueItems": true,
                "items": {
                  "type": "string",
                  "minLength": 1
                }
              }
            }
          }
        }
      ]
    },
    "invariant_source": {
      "type": "object",
      "additionalProperties": false,
      "required": [
        "profile_id",
        "profile_type",
        "profile_version",
        "manifest_sha256",
        "constraint_ids",
        "validator_binding"
      ],
      "properties": {
        "profile_id": {
          "$ref": "#/$defs/profile_id"
        },
        "profile_type": {
          "$ref": "#/$defs/profile_type"
        },
        "profile_version": {
          "$ref": "#/$defs/semver"
        },
        "manifest_sha256": {
          "$ref": "#/$defs/sha256"
        },
        "constraint_ids": {
          "type": "array",
          "minItems": 1,
          "uniqueItems": true,
          "items": {
            "type": "string",
            "minLength": 1
          }
        },
        "validator_binding": {
          "type": "object",
          "additionalProperties": false,
          "required": [
            "validator_id",
            "validator_version",
            "form_id"
          ],
          "properties": {
            "validator_id": {
              "type": "string"
            },
            "validator_version": {
              "$ref": "#/$defs/semver"
            },
            "form_id": {
              "type": "string"
            }
          }
        }
      }
    },
    "effective_invariant": {
      "type": "object",
      "additionalProperties": false,
      "required": [
        "invariant_id",
        "status",
        "provenance"
      ],
      "properties": {
        "invariant_id": {
          "type": "string",
          "pattern": "^CORE-[A-Z]+-[0-9]{3}$"
        },
        "status": {
          "enum": [
            "preserved",
            "strengthened"
          ]
        },
        "provenance": {
          "type": "array",
          "items": {
            "$ref": "#/$defs/invariant_source"
          }
        }
      },
      "allOf": [
        {
          "if": {
            "properties": {
              "status": {
                "const": "strengthened"
              }
            },
            "required": [
              "status"
            ]
          },
          "then": {
            "properties": {
              "provenance": {
                "minItems": 1
              }
            }
          }
        },
        {
          "if": {
            "properties": {
              "status": {
                "const": "preserved"
              }
            },
            "required": [
              "status"
            ]
          },
          "then": {
            "properties": {
              "provenance": {
                "maxItems": 0
              }
            }
          }
        }
      ]
    },
    "resource_source": {
      "type": "object",
      "additionalProperties": false,
      "required": [
        "profile_id",
        "profile_type",
        "profile_version",
        "manifest_sha256",
        "declared_path"
      ],
      "properties": {
        "profile_id": {
          "$ref": "#/$defs/profile_id"
        },
        "profile_type": {
          "$ref": "#/$defs/profile_type"
        },
        "profile_version": {
          "$ref": "#/$defs/semver"
        },
        "manifest_sha256": {
          "$ref": "#/$defs/sha256"
        },
        "declared_path": {
          "type": "string",
          "minLength": 1
        }
      }
    },
    "effective_resource": {
      "type": "object",
      "additionalProperties": false,
      "required": [
        "path",
        "role",
        "sha256",
        "byte_length",
        "content",
        "provenance"
      ],
      "properties": {
        "path": {
          "type": "string",
          "pattern": "^(?!/)(?!.*(?:^|/)\\.\\.(?:/|$))[A-Za-z0-9._/-]+$"
        },
        "role": {
          "type": "string",
          "pattern": "^[A-Z][A-Z0-9_]{0,63}$"
        },
        "sha256": {
          "$ref": "#/$defs/sha256"
        },
        "byte_length": {
          "type": "integer",
          "minimum": 0
        },
        "content": {
          "type": "string"
        },
        "provenance": {
          "type": "array",
          "minItems": 1,
          "uniqueItems": true,
          "items": {
            "$ref": "#/$defs/resource_source"
          }
        }
      }
    }
  }
}
