{"schema_version":"0.1.0","core_contracts":{"research_contract":"0.1.0","invariant_contract":"0.1.0"},"candidate_universe":[{"profile_id":"fixture.research-base","profile_type":"research","profile_version":"1.0.0","manifest_sha256":"6311662384e51505f779c16212fc1cd892dafeb0260c680e8a51490f0c263f34"},{"profile_id":"fixture.research-strict","profile_type":"research","profile_version":"1.1.0","manifest_sha256":"1d7bbbe2d43ac8e54da1cb1cb940dcf0be977543d97a8fb218a453969e50069d"},{"profile_id":"fixture.organization","profile_type":"organization","profile_version":"2.0.0","manifest_sha256":"888a427c2bc15acfa775af145dccc2eeeb1941d53cdb5144901a69d75d5014b5"},{"profile_id":"fixture.narrative","profile_type":"narrative","profile_version":"1.0.0","manifest_sha256":"c85bb1e8127d9145ccaf0d97df4c6a0bcbad37afeb2cd43c886889be9a7e3570"},{"profile_id":"fixture.publication","profile_type":"publication","profile_version":"1.0.0","manifest_sha256":"c47fad44c58ba2f1b53c6ee6a26724dd42e0190e58c9ab619dbdb625c1ff945e"}],"requested_profiles":[{"profile_id":"fixture.narrative","profile_type":"narrative","version":"1.0.0"},{"profile_id":"fixture.publication","profile_type":"publication","version":"1.0.0"}],"effective_profiles":[{"profile_id":"fixture.research-base","profile_type":"research","profile_version":"1.0.0","manifest_sha256":"6311662384e51505f779c16212fc1cd892dafeb0260c680e8a51490f0c263f34","selection_provenance":[{"relation":"extends","introduced_by":{"profile_id":"fixture.research-strict","profile_type":"research","profile_version":"1.1.0","manifest_sha256":"1d7bbbe2d43ac8e54da1cb1cb940dcf0be977543d97a8fb218a453969e50069d"},"required_version":">=1.0.0 <2.0.0"}]},{"profile_id":"fixture.research-strict","profile_type":"research","profile_version":"1.1.0","manifest_sha256":"1d7bbbe2d43ac8e54da1cb1cb940dcf0be977543d97a8fb218a453969e50069d","selection_provenance":[{"relation":"requires","introduced_by":{"profile_id":"fixture.organization","profile_type":"organization","profile_version":"2.0.0","manifest_sha256":"888a427c2bc15acfa775af145dccc2eeeb1941d53cdb5144901a69d75d5014b5"},"required_version":">=1.1.0 <2.0.0"}]},{"profile_id":"fixture.organization","profile_type":"organization","profile_version":"2.0.0","manifest_sha256":"888a427c2bc15acfa775af145dccc2eeeb1941d53cdb5144901a69d75d5014b5","selection_provenance":[{"relation":"requires","introduced_by":{"profile_id":"fixture.publication","profile_type":"publication","profile_version":"1.0.0","manifest_sha256":"c47fad44c58ba2f1b53c6ee6a26724dd42e0190e58c9ab619dbdb625c1ff945e"},"required_version":"2.0.0"}]},{"profile_id":"fixture.narrative","profile_type":"narrative","profile_version":"1.0.0","manifest_sha256":"c85bb1e8127d9145ccaf0d97df4c6a0bcbad37afeb2cd43c886889be9a7e3570","selection_provenance":[{"relation":"requested","required_version":"1.0.0"}]},{"profile_id":"fixture.publication","profile_type":"publication","profile_version":"1.0.0","manifest_sha256":"c47fad44c58ba2f1b53c6ee6a26724dd42e0190e58c9ab619dbdb625c1ff945e","selection_provenance":[{"relation":"requested","required_version":"1.0.0"}]}],"effective_constraints":[{"path":"evidence.capture.locator_precision","merge_strategy":"must_equal","value":"exact","resolution":"single","provenance":[{"profile_id":"fixture.research-strict","profile_type":"research","profile_version":"1.1.0","manifest_sha256":"1d7bbbe2d43ac8e54da1cb1cb940dcf0be977543d97a8fb218a453969e50069d","constraint_id":"FIX-RES-003"}]},{"path":"evidence.capture.required_fields","merge_strategy":"union","value":["captured_hash","locator","source_id"],"resolution":"union","provenance":[{"profile_id":"fixture.research-base","profile_type":"research","profile_version":"1.0.0","manifest_sha256":"6311662384e51505f779c16212fc1cd892dafeb0260c680e8a51490f0c263f34","constraint_id":"FIX-RES-001"},{"profile_id":"fixture.research-strict","profile_type":"research","profile_version":"1.1.0","manifest_sha256":"1d7bbbe2d43ac8e54da1cb1cb940dcf0be977543d97a8fb218a453969e50069d","constraint_id":"FIX-RES-002"}]},{"path":"narrative.semantic_stages","merge_strategy":"must_equal","value":["framing","synthesis"],"resolution":"single","provenance":[{"profile_id":"fixture.narrative","profile_type":"narrative","profile_version":"1.0.0","manifest_sha256":"c85bb1e8127d9145ccaf0d97df4c6a0bcbad37afeb2cd43c886889be9a7e3570","constraint_id":"FIX-NAR-001"}]},{"path":"organization.review.roles","merge_strategy":"union","value":["human-reviewer"],"resolution":"single","provenance":[{"profile_id":"fixture.organization","profile_type":"organization","profile_version":"2.0.0","manifest_sha256":"888a427c2bc15acfa775af145dccc2eeeb1941d53cdb5144901a69d75d5014b5","constraint_id":"FIX-ORG-001"}]},{"path":"publication.outputs.formats","merge_strategy":"union","value":["fixture-format"],"resolution":"single","provenance":[{"profile_id":"fixture.publication","profile_type":"publication","profile_version":"1.0.0","manifest_sha256":"c47fad44c58ba2f1b53c6ee6a26724dd42e0190e58c9ab619dbdb625c1ff945e","constraint_id":"FIX-PUB-001"}]}],"core_invariants":[{"invariant_id":"CORE-TRACE-001","status":"strengthened","provenance":[{"profile_id":"fixture.research-strict","profile_type":"research","profile_version":"1.1.0","manifest_sha256":"1d7bbbe2d43ac8e54da1cb1cb940dcf0be977543d97a8fb218a453969e50069d","constraint_ids":["FIX-RES-003"],"validator_binding":{"validator_id":"core.trace.evidence-source","validator_version":"0.1.0","form_id":"exact-locator"}}]},{"invariant_id":"CORE-TRACE-002","status":"preserved","provenance":[]},{"invariant_id":"CORE-TRACE-003","status":"preserved","provenance":[]},{"invariant_id":"CORE-TRACE-004","status":"preserved","provenance":[]},{"invariant_id":"CORE-PROV-001","status":"preserved","provenance":[]},{"invariant_id":"CORE-PROV-002","status":"preserved","provenance":[]},{"invariant_id":"CORE-PROV-003","status":"preserved","provenance":[]},{"invariant_id":"CORE-PROV-004","status":"preserved","provenance":[]},{"invariant_id":"CORE-REF-001","status":"preserved","provenance":[]},{"invariant_id":"CORE-AUTH-001","status":"preserved","provenance":[]},{"invariant_id":"CORE-FW-001","status":"preserved","provenance":[]},{"invariant_id":"CORE-EPI-001","status":"preserved","provenance":[]},{"invariant_id":"CORE-EPI-002","status":"preserved","provenance":[]}]}
